ticker,desc
OMH,"The principal activity of the Chief Entity is investment holding.  The principal activity of the Chief Entity's controlled entities is the mining, processing and sale of specialised metal materials."
PME,Development and supply of software and IT solutions to the Public and Private Health sectors
SKC,Gaming entertainment business.
SGR,"The Company operates The Star in Sydney, The Star Gold Coast and Treasury Casino & Hotel in Brisbane. The Company also manages the Gold Coast Convention and Exhibition Centre."
SYD,Airport Operations
INA,"Owns,operates and develops quality affordable seniors living accommodation for older Australians"
SLK,Provider of tourism and transport services.
BVS,"Provider of software products and services to clients operating in the wealth management and funds administration industries which support the functions needed to manage and administer financial products across investment products, wrap platforms, superannuation and pension, retirement, life insurance, private wealth and portfolio administration."
WGN,Diversified Australian construction materials provider focused on the production and sale of construction materials and is an innovative producer of new generation building materials through its composite fibre technologies and earth friendly concrete businesses.
CHC,"The Group is an integrated property group operating across property funds management, development, property investment banking, property management and property investment."
PDL,Global asset management
AX1,Accent owns and operates a number of footwear and apparel businesses in the performance and active lifestyle sectors.
TLS,"Telecommunications Carrier. Provision of telecommunications and information services, including mobiles, internet, and pay television."
NHF,Private health insurer
SLC,Telecommunications infrastructure and managed services
MGR,"Real estate investment, development and investment management."
MP1,Telecommunications
CYB,Banking products and services
MLX,"Tin and Copper mining, production and exploration. Nickel and other base metals exploration and development."
INR,Exploration for mineral deposits in the USA.
PRU,Mining and Mineral exploration
SEA,Oil and gas exploration
BLA,Diversified fund manager of alternative investments.
MYO,Provider of desktop and cloud business management software solutions to businesses and accounting practices in Australia and New Zealand.
FAR,Exploration for oil and gas
CQE,Ownership of established freehold early learning centers.
KGN,Online retail
ASX,"ASX is a fully integrated exchange across multiple asset classes - equities, fixed income, derivatives and managed funds. We service retail, institutional and corporate customers directly and through Australian and international intermediaries. 
We provi"
COL,"Australian retailer of products such as fresh food, groceries, household goods, liquor, fuel and financial services via stores and online"
GWA,"Supplier of building fixtures and fittings to residential and commercial premises, including sanitaryware and bathroom products, baths, tapware, sinks and laundry tubs, door hardware and access systems, and locksmithing services."
WGX,Mining producing entity
CLW,Investment in Australian real estate assets.
CIP,Holds a portfolio of industrial properties within Australia.
GMA,Provider of lenders mortgage insurance in Australia.
CGF,"The Company is a multi-faceted financial services organisation, with core businesses in annuities, funds management and administration platforms."
IMD,Provider of leading real time sub-surface technologies to the global minerals industry and other targeted non-mining markets.
FXL,"Point of sale lease and rental finance for the IT equipment, electrical appliance and other retail markets."
CTX,"Purchase, refining, distribution, and marketing of petroleum products and the operation of convenience stores."
PMV,Investment in listed securities;
LYC,Production of Rare Earths concentrate at Mt Weld.  Production and sale of Rare Earths products from the LAMP in Malaysia.
GDI,"Owning, managing and developing real estate assets and managing real estate funds on behalf of third party investors."
PPS,Portfolio administration services
GOZ,Investing in Australian commercial real estate
NEC,Media and entertainment company.
BOQ,"Banking, financial and related services."
LNG,"LNGL's Mission is to deliver safe, reliable, energy e¿¿¿cient, ¿¿¿exible mid-scale LNG liquefaction solutions at the industry¿¿¿s lowest full cycle cost to our customers and partners, while minimizing ecological impacts."
HSN,"Development, Integration and support of billings systems software for the telecommunications and utilities industries."
TAH,"The provision of gambling and other entertainment services. The company has wagering and media, gaming services, and Keno operations."
SCG,Property management and development.
AST,Electricity transmission and distribution and gas distribution.
SEK,Operator of online employment classifieds and education and training.
SVW,A diversified operating and investment group which comprises wholly-owned industrial operating businesses alongside key strategic investments in media and industrial equipment hire.
REG,Residential aged care provider.
VEA,"Manufacture, distribution and supply of petroleum products to retail and commercial customers."
WPL,"Management and operation of hydrocarbon exploration, development, production, transportation and marketing; implementation and operation of the North West Shelf Gas Project; exploration and development of gas, oil and condensate reserves."
